openreview_number,title,authorids,authors,keywords,abstract,accepted_elsewhere,publication_conference_if_published,decision,award,arXiv,webpage,poster_session
23,LoopDraw: a Loop-Based Autoregressive Model for Shape Synthesis and Editing,~Nam_Anh_Dinh1|~Haochen_Wang2|~Greg_Shakhnarovich1|~Rana_Hanocka1,Nam Anh Dinh|Haochen Wang|Greg Shakhnarovich|Rana Hanocka,loops|3D|modeling|editing|autoregressive|sequence,"There is no settled universal 3D representation for geometry with many alternatives such as point clouds, meshes, implicit functions, and voxels to name a few. In this work, we present a new, compelling alternative for representing shapes using a sequence of cross-sectional closed loops. The loops across all planes form an organizational hierarchy which we leverage for autoregressive shape synthesis and editing. Loops are a non-local description of the underlying shape, as simple loop manipulations (such as shifts) result in significant structural changes to the geometry. This is in contrast to manipulating local primitives such as points in a point cloud or a triangle in a triangle mesh. We further demonstrate that loops are intuitive and natural primitive for analyzing and editing shapes, both computationally and for users.",No,,Accept (Poster),,https://arxiv.org/abs/2212.04981,https://threedle.github.io/LoopDraw,2
25,Posterior Distillation Sampling,~Juil_Koo1|~Chanho_Park2|~Minhyuk_Sung1,Juil Koo|Chanho Park|Minhyuk Sung,Diffusion model|NeRF editing|3D Gaussian Splatting editing|SVG editing|SDS,"We introduce Posterior Distillation Sampling (PDS), a novel optimization method for parametric image editing based on diffusion models. Existing optimization-based methods, which leverage the powerful 2D prior of diffusion models to handle various parametric images, have mainly focused on generation. Unlike generation, editing requires a balance between conforming to the target attribute and preserving the identity of the source content. Recent 2D image editing methods have achieved this balance by leveraging the stochastic latent encoded in the generative process of diffusion models. To extend the editing capabilities of diffusion models shown in pixel space to parameter space, we reformulate the 2D image editing method into an optimization form named PDS. PDS matches the stochastic latents of the source and the target, enabling the sampling of targets in diverse parameter spaces that align with a desired attribute while maintaining the source's identity. We demonstrate that this optimization resembles running a generative process with the target attribute, but aligning this process with the trajectory of the source's generative process. Extensive editing results in Neural Radiance Fields and Scalable Vector Graphics representations demonstrate that PDS is capable of sampling targets to fulfill the aforementioned balance across various parameter spaces.",Yes,CVPR24,Accept (Poster),,https://arxiv.org/abs/2311.13831,https://posterior-distillation-sampling.github.io/,1
28,Text Prompting for Multi-Concept Video Customization by Autoregressive Generation,~Divya_Kothandaraman1|~Kihyuk_Sohn1|~Ruben_Villegas1|~Paul_Voigtlaender1|~Dinesh_Manocha3|~Mohammad_Babaeizadeh1,Divya Kothandaraman|Kihyuk Sohn|Ruben Villegas|Paul Voigtlaender|Dinesh Manocha|Mohammad Babaeizadeh,multi-concept video customization|prompting|autoregressive generation;,"We present a method for multi-concept customization of pretrained text-to-video (T2V) models. Intuitively, the multi-concept customized video can be derived from the (non-linear) intersection of the video manifolds of the individual concepts, which is not straightforward to find. We hypothesize that sequential and controlled walking towards the intersection of the video manifolds, directed by text prompting, leads to the solution. To do so, we generate the various concepts and their corresponding interactions, sequentially, in an autoregressive manner. Our method can generate videos of multiple custom concepts (subjects, action and background) such as a teddy bear running towards a brown teapot, a dog playing violin and a teddy bear swimming in the ocean. We quantitatively evaluate our method using videoCLIP and DINO scores, in addition to human evaluation.",No,,Accept (Poster),,http://arxiv.org/abs/2405.13951,https://github.com/divyakraman/MultiConceptVideo2024,2
29,The Lost Melody: Empirical Observations on Text-to-Video Generation From A Storytelling Perspective,~Andrew_Shin1|~Yusuke_Mori1|~Kunitake_Kaneko1,Andrew Shin|Yusuke Mori|Kunitake Kaneko,text-to-video generation|generative models|story evaluation,"Text-to-video generation task has witnessed a notable progress, with the generated outcomes reflecting the text prompts with high fidelity and impressive visual qualities. However, current text-to-video generation models are invariably focused on conveying the visual elements of a single scene, and have so far been indifferent to another important potential of the medium, namely a storytelling. In this paper, we examine text-to-video generation from a storytelling perspective, which has been hardly investigated, and make empirical remarks that spotlight the limitations of current text-to-video generation scheme. We also propose an evaluation framework for storytelling aspects of videos, and discuss the potential future directions.",No,,Accept (Poster),,https://arxiv.org/abs/2405.08720,,1
30,Towards Safer AI Content Creation by Immunizing Text-to-image Models,~Amber_Yijia_Zheng1|~Raymond_A._Yeh1,Amber Yijia Zheng|Raymond A. Yeh,DreamBooth|Textual-Inversion|Diffusion model,"Advancements in open-sourced text-to-image models and fine-tuning methods have led to the increasing risk of malicious adaptation, i.e., fine-tuning to generate harmful/unauthorized content. Recent works, e.g., Glaze or MIST, have developed data-poisoning techniques which protect the data against adaptation methods. In this work, we consider an alternative paradigm for protection. We propose to ``immunize'' the model by learning model parameters that are difficult for the adaptation methods when fine-tuning malicious content; in short IMMA. Specifically, IMMA should be applied before the release of the model weights to mitigate these risks. Empirical results show IMMA's effectiveness against malicious adaptations, including mimicking the artistic style and learning of inappropriate/unauthorized content, over three adaptation methods: LoRA, Textual-Inversion, and DreamBooth.",No,,Accept (Poster),,,,2
31,Reference-based Painterly Inpainting via Diffusion: Crossing the Wild Reference Domain Gap,~Dejia_Xu1|~Xingqian_Xu2|~Wenyan_Cong1|~Humphrey_Shi1|~Zhangyang_Wang1,Dejia Xu|Xingqian Xu|Wenyan Cong|Humphrey Shi|Zhangyang Wang,image inpainting|diffusion model,"Have you ever imagined how it would look if we placed new objects into paintings? For example, what would it look like if we placed a basketball into Claude Monet's ''Water Lilies, Evening Effect''?
We propose Reference-based Painterly Inpainting, a novel task that crosses the wild reference domain gap and implants novel objects into artworks. Although previous works have examined reference-based inpainting, they are not designed for large domain discrepancies between the target and the reference, such as inpainting an artistic image using a photorealistic reference. This paper proposes a novel diffusion framework, dubbed RefPaint, to ``inpaint more wildly'' by taking such references with large domain gaps. Built with an image-conditioned diffusion model, we introduce a ladder-side branch and a masked fusion mechanism to work with the inpainting mask. By decomposing the CLIP image embeddings at inference time, one can manipulate the strength of semantic and style information with ease. Experiments demonstrate that our proposed RefPaint framework produces significantly better results than existing methods. Our method enables creative painterly image inpainting with reference objects that would otherwise be difficult to achieve.",No,,Accept (Poster),,,,1
32,Spatial Steerability of GANs via Self-Supervision from Discriminator,~Jianyuan_Wang2|~Lalit_Bhagat1|~Ceyuan_Yang2|~Yinghao_Xu1|~Yujun_Shen1|~Hongdong_Li1|~Bolei_Zhou5,Jianyuan Wang|Lalit Bhagat|Ceyuan Yang|Yinghao Xu|Yujun Shen|Hongdong Li|Bolei Zhou,Generative models|spatial editing|interpretability,"In this work, we propose a self-supervised approach to improve the spatial steerability of GANs without searching for steerable directions in the latent space or requiring extra annotations. Specifically, we design randomly sampled Gaussian heatmaps to be encoded into the intermediate layers of generative models as spatial inductive bias. Along with training the GAN model from scratch, these heatmaps are being aligned with the emerging attention of the GAN's discriminator in a self-supervised learning manner. During inference, users can interact with the spatial heatmaps intuitively, enabling them to edit the output image by adjusting the scene layout, moving, or removing objects. Moreover, we incorporate DragGAN into our framework, which facilitates fine-grained manipulation within a reasonable time and supports a coarse-to-fine editing process. Extensive experiments show that the proposed method not only enables spatial editing over human faces, animal faces, outdoor scenes, and complicated multi-object indoor scenes but also brings improvement in synthesis quality.",Yes,CVPR22,Accept (Poster),,,,2
33,Paint-it: Text-to-Texture Synthesis via Deep Convolutional Texture Map Optimization and Physically-Based Rendering,~Kim_Youwang1|~Tae-Hyun_Oh3|~Gerard_Pons-Moll2,Kim Youwang|Tae-Hyun Oh|Gerard Pons-Moll,Text-driven texture synthesis|Neural re-parameterization|Physically-Based Rendering,"We present Paint-it, a text-driven high-fidelity texture map synthesis method for 3D meshes via neural re-parameterized texture optimization. Paint-it synthesizes texture maps from a text description by synthesis-through-optimization, exploiting the Score-Distillation Sampling (SDS). We observe that directly applying SDS yields undesirable texture quality due to its noisy gradients. We reveal the importance of texture parameterization when using SDS. Specifically, we propose Deep Convolutional Physically-Based Rendering (DC-PBR) parameterization, which re-parameterizes the physically-based rendering (PBR) texture maps with randomly initialized convolution-based neural kernels, instead of a standard pixel-based parameterization. We show that DC-PBR inherently schedules the optimization curriculum according to texture frequency and naturally filters out the noisy signals from SDS. In experiments, Paint-it obtains remarkable quality PBR texture maps within 15 min., given only a text description. We demonstrate the generalizability and practicality of Paint-it by synthesizing high-quality texture maps for large-scale mesh datasets and showing test-time applications such as relighting and material control using a popular graphics engine. Project page: https://kim-youwang.github.io/paint-it",Yes,CVPR24,Accept (Poster),,https://arxiv.org/abs/2312.11360,https://kim-youwang.github.io/paint-it,1
34,InstructRL4Pix: Training Diffusion for Image Editing by Reinforcement Learning,~Tiancheng_Li4|~Jinxiu_Liu1|~Chen_Huajun1|~Qi_Liu19,Tiancheng Li|Jinxiu Liu|Chen Huajun|Qi Liu,image editing， diffusion model， reinforcement learning,"Instruction-based image editing has made great process in using natural human language to manipulate the visual content of images. However, existing models are limited by the quality of the dataset and cannot accurately localize editing regions in images with complex object relationships. In this paper, we propose Reinforcement Learning Guided Image Editing Method(InstructRL4Pix) to train a diffusion model to generate images that are guided by the attention maps of the target object. Our method maximizes the output of the reward model by calculating the distance between attention maps as a reward function and fine-tuning the diffusion model using proximal policy optimization (PPO). We evaluate our model in object insertion, removal, replacement, and transformation. Experimental results show that InstructRL4Pix breaks through the limitations of traditional datasets and uses unsupervised learning to optimize editing goals and achieve accurate image editing based on natural human commands.",No,,Accept (Poster),,,,2
35,Seamless Human Motion Composition with Blended Positional Encodings,~German_Barquero1|~Sergio_Escalera1|~Cristina_Palmero1,German Barquero|Sergio Escalera|Cristina Palmero,human motion|motion composition|motion generation|text-to-motion|temporal composition|diffusion|generative ai|blended positional encodings|bpe|relative encodings,"Conditional human motion generation is an important topic with many applications in virtual reality, gaming, and robotics. While prior works have focused on generating motion guided by text, music, or scenes, these typically result in isolated motions confined to short durations. Instead, we address the generation of long, continuous sequences guided by a series of varying textual descriptions. In this context, we introduce FlowMDM, the first diffusion-based model that generates seamless Human Motion Compositions (HMC) without any postprocessing or redundant denoising steps. For this, we introduce the Blended Positional Encodings, a technique that leverages both absolute and relative positional encodings in the denoising chain. More specifically, global motion coherence is recovered at the absolute stage, whereas smooth and realistic transitions are built at the relative stage. As a result, we achieve state-of-the-art results in terms of accuracy, realism, and smoothness on the Babel and HumanML3D datasets. FlowMDM excels when trained with only a single description per motion sequence thanks to its Pose-Centric Cross-ATtention, which makes it robust against varying text descriptions at inference time. Finally, to address the limitations of existing HMC metrics, we propose two new metrics: the Peak Jerk and the Area Under the Jerk, to detect abrupt transitions.",Yes,CVPR24,Accept (Poster),,https://arxiv.org/abs/2402.15509,https://barquerogerman.github.io/FlowMDM/,1
36,CustomText: Customized Textual Image Generation using Diffusion Models,~Shubham_Paliwal1|~Arushi_Jain3|~Monika_Sharma2|~Vikram_Jamwal1|~Lovekesh_Vig1,Shubham Paliwal|Arushi Jain|Monika Sharma|Vikram Jamwal|Lovekesh Vig,Image Editing|Diffusion Models|ControlNet|Consistency Decoder|Textual Image,"Textual image generation spans diverse fields like advertising, education, product packaging, social media, information visualization, and branding. Despite recent strides in language-guided image synthesis using diffusion models, current models excel in image generation but struggle with accurate text rendering and offer limited control over font attributes. In this paper, we aim to enhance the synthesis of high-quality images with precise text customization, thereby contributing to the advancement of image generation models. We call our proposed method CustomText. Our implementation leverages a pre-trained TextDiffuser model to enable control over font color, background, and types. Additionally, to address the challenge of accurately rendering small sized fonts, we train the ControlNet model for a consistency decoder, significantly enhancing text-generation performance. We assess the performance of CustomText in comparison to previous methods of textual image generation, showcasing superior results.",No,,Accept (Poster),,https://arxiv.org/abs/2405.12531,,2
38,The Curious Case of End Token: A Zero-Shot Disentangled Image Editing using CLIP,~Hidir_Yesiltepe1|~Yusuf_Dalva1|~Pinar_Yanardag1,Hidir Yesiltepe|Yusuf Dalva|Pinar Yanardag,diffusion|editing|clip,"Diffusion models have become prominent in creating high-quality images. However, unlike GAN models celebrated for their ability to edit images in a disentangled manner, diffusion-based text-to-image models struggle to achieve the same level of precise attribute manipulation without compromising image coherence. In this paper, CLIP which is often used in popular text-to-image diffusion models such as Stable Diffusion is capable of performing disentangled editing in a zero-shot manner. Through both qualitative and quantitative comparisons with state-of-the-art editing methods, we show that our approach yields competitive results. This insight may open opportunities for applying this method to various tasks, including image and video editing, providing a lightweight and efficient approach for disentangled editing.",No,,Accept (Poster),,,,2
39,SSR-Encoder: Encoding Selective Subject Representation for Subject-Driven Generation,~Yuxuan_Zhang3|~Yiren_Song1|~Jiaming_Liu7|~Rui_Wang33|~Jinpeng_Yu1|~Hao_Tang6|~Huaxia_Li1|~Xu_Tang1|~Yao_Hu1|~Han_SJTU_Pan1|~Zhongliang_Jing1,Yuxuan Zhang|Yiren Song|Jiaming Liu|Rui Wang|Jinpeng Yu|Hao Tang|Huaxia Li|Xu Tang|Yao Hu|Han SJTU Pan|Zhongliang Jing,subject-driven image generation|diffusion,"Recent advancements in subject-driven image generation have led to zero-shot generation, yet precise selection and focus on crucial subject representations remain challenging. Addressing this, we introduce the SSR-Encoder, a novel architecture designed for selectively capturing any subject from single or multiple reference images. It responds to various query modalities including text and masks, without necessitating test-time fine-tuning. The SSR-Encoder combines a Token-to-Patch Aligner that aligns query inputs with image patches and a Detail-Preserving Subject Encoder for extracting and preserving fine features of the subjects, thereby generating subject embeddings. These embeddings, used in conjunction with original text embeddings, condition the generation process. Characterized by its model generalizability and efficiency, the SSR-Encoder adapts to a range of custom models and control modules. Enhanced by the Embedding Consistency Regularization Loss for improved training, our extensive experiments demonstrate its effectiveness in versatile and high-quality image generation, indicating its broad applicability.",Yes,CVPR24,Accept (Poster),,,,1
41,CamViG: Camera Aware Image-to-Video Generation with Multimodal Transformers,~Andrew_Marmon1|~Grant_Schindler3|~Jose_Lezama1|~Dan_Kondratyuk1|~Bryan_Seybold1|~Irfan_Essa1,Andrew Marmon|Grant Schindler|Jose Lezama|Dan Kondratyuk|Bryan Seybold|Irfan Essa,Generative Video|3D Cameras,"We extend multimodal transformers to include 3D camera motion as a conditioning signal for the task of video generation. Generative video models are becoming increasingly powerful, thus focusing research efforts on methods of controlling the output of such models. We propose to add virtual 3D camera controls to generative video methods by conditioning generated video on an encoding of three-dimensional camera movement over the course of the generated video. Results demonstrate that we are (1) able to successfully control the camera during video generation, starting from a single frame and a camera signal, and (2) we demonstrate the accuracy of the generated 3D camera paths using traditional computer vision methods.",No,,Accept (Poster),,https://arxiv.org/abs/2405.13195,,1
42,ViVid-1-to-3: Novel View Synthesis with Video Diffusion Models,~Jeong-gi_Kwak1|~Erqun_Dong1|~Yuhe_Jin1|~Hanseok_Ko1|~Shweta_Mahajan1|~Kwang_Moo_Yi1,Jeong-gi Kwak|Erqun Dong|Yuhe Jin|Hanseok Ko|Shweta Mahajan|Kwang Moo Yi,Novel-view synthesis|Diffusion models|Video diffusion,"Generating novel views of an object from a single image is a challenging task. It requires an understanding of the underlying 3D structure of the object from an image and rendering high-quality, spatially consistent new views. While recent methods for view synthesis based on diffusion have shown great progress, achieving consistency among various view estimates and at the same time abiding by the desired camera pose remains a critical problem yet to be solved. In this work, we demonstrate a strikingly simple method, where we utilize a pre-trained video diffusion model to solve this problem. Our key idea is that synthesizing a novel view could be reformulated as synthesizing a video of a camera going around the object of interest---a scanning video---which then allows us to leverage the powerful priors that a video diffusion model would have learned. Thus, to perform novel-view synthesis, we create a smooth camera trajectory to the target view that we wish to render, and denoise using both a view-conditioned diffusion model and a video diffusion model. By doing so, we obtain a highly consistent novel view synthesis, outperforming the state of the art.",Yes,CVPR24,Accept (Poster),,https://arxiv.org/abs/2312.01305/,https://ubc-vision.github.io/vivid123/,2
43,DL3DV-10K: A Large-Scale Scene Dataset for Deep Learning-based 3D Vision,~Lu_Ling1|~Yichen_Sheng1|~Zhi_Tu1|~Wentian_Zhao3|~Cheng_Xin2|~Kun_Wan1|~Lantao_Yu3|~Qianyu_Guo3|~Zixun_Yu1|~Yawen_Lu2|~Xuanmao_Li1|~Xingpeng_Sun1|~Rohan_Ashok1|~Aniruddha_Mukherjee1|~Hao_Kang2|~Xiangrui_Kong1|~Gang_Hua3|~Tianyi_Zhang7|~Bedrich_Benes1|~Aniket_Bera1,Lu Ling|Yichen Sheng|Zhi Tu|Wentian Zhao|Cheng Xin|Kun Wan|Lantao Yu|Qianyu Guo|Zixun Yu|Yawen Lu|Xuanmao Li|Xingpeng Sun|Rohan Ashok|Aniruddha Mukherjee|Hao Kang|Xiangrui Kong|Gang Hua|Tianyi Zhang|Bedrich Benes|Aniket Bera,Scene Dataset|3D Representation|Foundation Model|Neural Radiance Field,"We have witnessed significant progress in deep learning-based 3D vision, ranging from neural radiance field (NeRF) based 3D representation learning to applications in novel view synthesis (NVS). However, existing scene-level datasets for deep learning-based 3D vision, limited to either synthetic environments or a narrow selection of real-world scenes, are quite insufficient. This insufficiency not only hinders a comprehensive benchmark of existing methods but also caps what could be explored in deep learning-based 3D analysis. To address this critical gap, we present DL3DV-10K, a large-scale scene dataset featuring 51.2 million frames from 10,510 videos captured from 65 types of point-of-interest (POI) locations, covering both bounded and unbounded scenes, with different levels of reflection, transparency, and lighting. We conducted a comprehensive benchmark of recent NVS methods on DL3DV-10K, which revealed valuable insights for future research in NVS. In addition, we have obtained encouraging results in a pilot study to learn generalizable NeRF from DL3DV-10K, which manifests the necessity of a large-scale scene-level dataset to forge a path toward a foundation model for learning 3D representation. Our DL3DV-10K dataset, benchmark results, and models will be publicly accessible.",Yes,CVPR24,Accept (Poster),,https://arxiv.org/pdf/2312.16256,https://arxiv.org/pdf/2312.16256,1
44,Temporally Consistent Object Editing in Videos using Extended Attention,~AmirHossein_Zamani1|~Amir_Aghdam1|~Tiberiu_Popa1|~Eugene_Belilovsky1,AmirHossein Zamani|Amir Aghdam|Tiberiu Popa|Eugene Belilovsky,Video editing|inpainting diffusion model|temporal consistency|extended attention modules|video retargeting,"Image generation and editing have seen a great deal of advancements with the rise of large-scale diffusion models that allow user control of different modalities such as text, mask, depth maps, etc. However, controlled editing of videos still lags behind. Prior work in this area has focused on using 2D diffusion models to globally change the style of an existing video. On the other hand in many practical applications editing localized parts of the video is critical. In this work, we propose a method to edit videos using a pre-trained inpainting image diffusion model. We systematically redesign the forward path of the model by replacing the self-attention modules with an extended version of attention modules that creates frame-level dependencies. In this way, we ensure that the edited information will be consistent across all the video frames no matter what the shape and position of the masked area is. We qualitatively compare our results with state-of-the-art in terms of accuracy on several video editing tasks like object retargeting, object replacement, and object removal tasks. Simulations demonstrate the superior performance of the proposed strategy.",No,,Accept (Poster),,,,2
45,ElasticDiffusion: Training-free Arbitrary Size Image Generation,~Moayed_Haji-Ali1|~Guha_Balakrishnan1|~Vicente_Ordonez2,Moayed Haji-Ali|Guha Balakrishnan|Vicente Ordonez,Diffusion models|Image Generation|Text2Image|Higher-resolution|Arbitrary-size,"Diffusion models have revolutionized image generation in recent years, yet they are still limited to a few sizes and aspect ratios. We propose ElasticDiffusion, a novel training-free decoding method that enables pretrained text-to-image diffusion models to generate images with various sizes. ElasticDiffusion attempts to decouple the generation trajectory of a pretrained model into local and global signals. The local signal controls low-level pixel information and can be estimated on local patches, while the global signal is used to maintain overall structural consistency and is estimated with a reference image. Our experiments on two datasets: CelebA-HQ (faces), and LAION-COCO (objects/indoor/outdoor scenes) demonstrate higher perceptual quality across aspect ratios compared to MultiDiffusion and the standard decoding strategy for Stable Diffusion. We test our method on CelebA-HQ (faces) and LAION-COCO (objects/indoor/outdoor scenes). Our experiments and qualitative results show superior image coherence quality across aspect ratios compared to MultiDiffusion and the standard decoding strategy of Stable Diffusion.",Yes,CVPR24,Accept (Poster),,,,1
