openreview_number,title,authorids,authors,keywords,abstract,accepted_elsewhere,publication_conference_if_published,decision,award,arXiv,webpage,poster_session
46,ClickDiffusion: Harnessing LLMs for Interactive Precise Image Editing,~Alec_Helbling1|~Seongmin_Lee2|~Duen_Horng_Chau1,Alec Helbling|Seongmin Lee|Duen Horng Chau,Diffusion|LLM|Multi-modal,"Recently, researchers have proposed powerful systems for generating and manipulating images using natural language instructions. However, it is difficult to precisely specify many common classes of image transformations with text alone. For example, a user may wish to change the location and breed of a particular dog in an image with several similar dogs. This task is quite difficult with natural language alone, and would require a user to write a laboriously complex prompt that both disambiguates the target dog and describes the destination. We propose ClickDiffusion, a system for precise image manipulation and generation that combines natural language instructions with visual feedback provided by the user through a direct manipulation interface. We demonstrate that by serializing both an image and a multi-modal instruction into a textual representation it is possible to leverage LLMs to perform precise transformations of the layout and appearance of an image.",No,,Accept (Poster),,https://arxiv.org/abs/2404.04376,https://github.com/poloclub/ClickDiffusion/tree/main,2
48,EraseDraw: Learning to Insert Objects by Erasing Them from Images,~Alper_Canberk1|~Maksym_Bondarenko1|~Ege_Ozguroglu1|~Ruoshi_Liu2|~Carl_Vondrick2,Alper Canberk|Maksym Bondarenko|Ege Ozguroglu|Ruoshi Liu|Carl Vondrick,content creation|image editing|object insertion|dataset creation,"Creative processes like painting involve creating different components of an image one by one. Can we build a computational model to perform this task? Prior works often fail by making global changes to the image, inserting objects in unrealistic spatial locations, and generating inaccurate lighting details. We observe that while state-of-the-art models perform poorly on object insertion, they can remove objects and erase the background in natural images very well. Inverting the direction of object removal, we obtain high-quality data for learning to insert objects that are spatially, physically, and optically consistent with the surroundings. With this scalable automatic data generation pipeline, we create a dataset for learning object insertion, which is used to train our text-conditioned diffusion model. Qualitative and quantitative experiments have shown that our model achieves state-of-the-art results in object insertion, particularly for in-the-wild images. We show compelling results on diverse insertion prompts and images across various domains. In addition, we pioneer iterative image generation by combining our insertion model with beam search guided by CLIP.",No,,Accept (Poster),,,,2
50,ICE-G: Image Conditional Editing of 3D Gaussian Splats,~Vishnu_Jaganathan1|~Hanyun_Huang1|~Muhammad_Zubair_Irshad1|~Varun_Jampani2|~Amit_Raj1|~Zsolt_Kira1,Vishnu Jaganathan|Hanyun Huang|Muhammad Zubair Irshad|Varun Jampani|Amit Raj|Zsolt Kira,Gaussian Splatting|NeRFs|3D editing|DINO,"Recently many techniques have emerged to create high quality 3D assets and scenes. When it comes to editing of these objects, however, existing approaches are either slow, compromise on quality, or do not provide enough customization. We introduce a novel approach to quickly edit a 3D model from a single reference view. Our technique first segments the edit image, and then matches semantically corresponding regions across chosen segmented dataset views using DINO features. A color or texture change from a particular region of the edit image can then be applied to other views automatically in a semantically sensible manner. These edited views act as an updated dataset to further train and re-style the 3D scene. The end-result is therefore an edited 3D model. Our framework enables a wide variety of editing tasks such as manual local edits, correspondence based style transfer from any example image, and a combination of different styles from multiple example images. We use Gaussian Splats as our primary 3D representation due to their speed and ease of local editing, but our technique works for other methods such as NeRFs as well. We show through multiple examples that our method produces higher quality results while offering fine grained control of editing.",No,,Accept (Poster),,,https://ice-gaussian.github.io/,1
53,TriLoRA: Integrating SVD for Advanced Style Personalization in Text-to-Image,~Chengcheng_Feng1|~mu_he2|~Xiaofang_Zhao1|~haojie_yin1|~Qiuyu_Tian1|~Tang_Hongwei1|~Xing_Qiang_Wei2,Chengcheng Feng|mu he|Xiaofang Zhao|haojie yin|Qiuyu Tian|Tang Hongwei|Xing Qiang Wei,Diffusion Model|Stable Diffusion|Fine-tuning|LoRA,"As deep learning technology continues to advance, image generation models, especially models like Stable Diffusion, are finding increasingly widespread application in visual arts creation. However, these models often face challenges such as overfitting, lack of stability in generated results, and difficulties in accurately capturing the features desired by creators during the fine-tuning process. In response to these challenges, we propose an innovative method that integrates Singular Value Decomposition (SVD) into the Low-Rank Adaptation (LoRA) parameter update strategy, aimed at enhancing the fine-tuning efficiency and output quality of image generation models. By incorporating SVD within the LoRA framework, our method not only effectively reduces the risk of overfitting but also enhances the stability of model outputs, and captures subtle, creator-desired feature adjustments more accurately. We evaluated our method on multiple datasets, and the results show that, compared to traditional fine-tuning methods, our approach significantly improves the model's generalization ability and creative flexibility while maintaining the quality of generation. Moreover, this method maintains LoRA's excellent performance under resource-constrained conditions, allowing for significant improvements in image generation quality without sacrificing the original efficiency and resource advantages.",No,,Accept (Poster),,,,1
54,LEAST: Local text-conditioned image style transfer,~Silky_Singh1|~Surgan_Jandial2|~Simra_Shahid1|~Abhinav_Java1,Silky Singh|Surgan Jandial|Simra Shahid|Abhinav Java,style transfer|image editing,"Text-conditioned style transfer enables users to communicate their desired artistic styles through text descriptions, offering a new and expressive means of achieving stylization. In this work, we evaluate the text-conditioned image editing and style transfer techniques on their fine-grained understanding of user prompts for precise “local” style transfer. We find that current methods fail to accomplish localized style transfers effectively, either failing to localize style transfer to certain regions in the image, or distorting the content and structure of the input image. To this end, we carefully design an end-to-end pipeline that guarantees local style transfer according to users’ intent. Further, we substantiate the effectiveness of our approach through quantitative and qualitative analysis.",No,,Accept (Poster),,https://arxiv.org/abs/2405.16330,https://github.com/silky1708/local-style-transfer,2
55,My Body My Choice: Human-Centric Full-Body Anonymization,~Umur_A._Ciftci1|~Ali_Kemal_Tanriverdi1|~Ilke_Demir3,Umur A. Ciftci|Ali Kemal Tanriverdi|Ilke Demir,guided generative AI|body anonymization|human generation|adversarial attack,"In an era of increasing privacy concerns for our online presence, we propose that the decision to appear in a piece of content should only belong to the owner of the body. Although some automatic approaches for full-body anonymization have been proposed, human-guided anonymization can adapt to various contexts, such as cultural norms, personal relations, esthetic concerns, and security issues. ""My Body My Choice"" (MBMC) enables physical and adversarial anonymization by removal and swapping approaches aimed for four tasks, designed by single or multi, ControlNet or GAN modules, combining several diffusion models. We evaluate anonymization on seven datasets; compare with SOTA inpainting and anonymization methods; evaluate by image, adversarial, and generative metrics; and conduct reidentification experiments.",No,,Accept (Poster),,,,1
